{
  "specRoot": "specs/",
  "specVersion": "C++风格版v1.0",
  "queryTemplates": {
    "query": "./templates/spec-query.md",
    "compare": "./templates/spec-compare.md",
    "summary": "./templates/spec-summary.md"
  },
  "crossReferenceEnabled": true,
  "ebnfExtractionEnabled": true,
  "designDecisionTracing": true,
  "specDocumentIndex": {
    "01a": "01a-词法结构-总览与关键字.md",
    "01b": "01b-词法结构-字面量与运算符.md",
    "02": "02-类型系统.md",
    "03": "03-语句与控制流.md",
    "04": "04-函数与函数指针.md",
    "05": "05-结构体与枚举.md",
    "06": "06-OOP面向对象.md",
    "07": "07-错误处理.md",
    "08": "08-模块系统.md"
  },
  "keywordMapping": {
    "关键字": "01a", "标识符": "01a", "注释": "01a", "源文件": "01a", "友元": "01a",
    "字面量": "01b", "运算符": "01b", "优先级": "01b", "字符串": "01b", "原始": "01b", "多行": "01b", "三元": "01b", "运算符重载": "01b",
    "类型": "02", "整数": "02", "浮点": "02", "字符": "02", "布尔": "02", "指针": "02", "数组": "02", "联合体": "02", "结果": "02", "可选": "02", "隐式转换": "02",
    "变量": "03", "常量": "03", "函数": "03", "如果": "03", "否则": "03", "当": "03", "循环": "03", "选择": "03", "情况": "03", "默认": "03", "中断": "03", "继续": "03",
    "函数指针": "04", "递归": "04", "构造器": "04", "重载": "04", "默认参数": "04", "lambda": "04", "强制转换": "04",
    "结构体": "05", "枚举": "05",
    "类": "06", "继承": "06", "接口": "06", "虚拟": "06", "重写": "06", "抽象": "06", "实现": "06", "自身": "06", "父类": "06", "保护": "06", "构造": "06", "析构": "06", "虚表": "06", "静态成员": "06", "常量成员": "06", "模板": "06",
    "错误处理": "07", "错误码": "07",
    "模块": "08", "导入": "08", "从": "08", "公开": "08", "私有": "08", "可见性": "08"
  }
}
